{
  "$schema": "https://json-schema.org/draft/2020-12/schema",
  "$id": "https://raw.githubusercontent.com/RomanAgaltsev/bigo/main/schema/report.schema.json",
  "title": "bigo report",
  "description": "Machine-readable output of `bigo json`: per-function inferred asymptotic bounds, budget verdicts, unverifiability causes, and the trust surface. Stability policy: schema_version is semver, independent of bigo releases; within a major version changes are additive-only and no field is ever reinterpreted. Consumers must ignore unknown fields.",
  "type": "object",
  "required": ["schema_version", "bigo_version", "module", "generated", "functions"],
  "properties": {
    "schema_version": {
      "type": "string",
      "description": "Semver of this document format."
    },
    "bigo_version": {
      "type": "string",
      "description": "The bigo release that produced the document."
    },
    "module": {
      "type": "string",
      "description": "Go module path of the analyzed code; empty outside module mode."
    },
    "generated": {
      "type": "string",
      "format": "date-time",
      "description": "Document creation time, RFC 3339 UTC."
    },
    "functions": {
      "type": "array",
      "description": "Every analyzed function and method, budgeted or not, sorted by package, file, line.",
      "items": { "$ref": "#/$defs/function" }
    },
    "trusted": {
      "type": "array",
      "description": "Every //bigo:cost and //bigo:ignore assertion found — the document's trust surface. Any entry may have influenced any verdict; audit these when auditing a document. v1 lists function-attached assertions; interface-method costs are a planned additive extension.",
      "items": { "$ref": "#/$defs/trustEntry" }
    },
    "smells": {
      "type": "array",
      "description": "Advisory smell findings (SM1..SM8), sorted by file, line, rule. Deliberately top-level and never attached to a function record: a smell is advisory and can never influence a verdict, and the schema mirrors that firewall. Added in schema 1.1.0; absent in 1.0.0 documents and omitted when empty. Entries carry package since 1.4.0.",
      "items": { "$ref": "#/$defs/smell" }
    },
    "recognitions": {
      "type": "array",
      "description": "Advisory recognized shapes, sorted by file, line, pattern. Each is the conventional bound for a named algorithmic pattern, together with the assumption it rests on. Deliberately top-level and never attached to a function record, for the same reason smells are: a recognition can never influence a verdict, and the schema mirrors that firewall. A recognized bound is NOT a proved bound and may name a quantity the bound algebra cannot express. Added in schema 1.5.0; omitted when empty.",
      "items": { "$ref": "#/$defs/recognition" }
    },
    "assumptions": {
      "type": "array",
      "description": "External assumptions (-assume file) in force during the run — the assumption analog of trusted: any entry may have influenced any verdict; audit these when auditing a document. Added in schema 1.2.0; omitted when no assumption file was supplied.",
      "items": { "$ref": "#/$defs/assumption" }
    }
  },
  "$defs": {
    "recognition": {
      "type": "object",
      "required": ["func", "pattern", "kind", "bound", "assumption", "file", "line"],
      "properties": {
        "package": {
          "type": "string",
          "description": "Go package path owning the recognized function."
        },
        "func": {
          "type": "string",
          "description": "Name of the function the shape was matched in."
        },
        "pattern": {
          "type": "string",
          "description": "Stable identifier for the matched shape, e.g. \"amortized two-pointer scan\". Consumers may count coverage by this value."
        },
        "kind": {
          "type": "string",
          "description": "Which case the bound describes. Carried explicitly because labelling an amortized bound as expected would ship a false statement.",
          "enum": ["worst", "amortized", "expected"]
        },
        "bound": {
          "type": "string",
          "description": "The conventional bound for this pattern, as RENDERED TEXT rather than a serialized bound. It may name a quantity the bound algebra cannot express, such as the number of nodes reachable from a pointer, which is sound only because a recognition carries no verdict power."
        },
        "assumption": {
          "type": "string",
          "description": "The preconditions the bound rests on, including any bigo cannot itself verify. This is what makes an advisory claim honest rather than merely unproved, and consumers must not present the bound without it."
        },
        "file": {
          "type": "string",
          "description": "Module-relative path, forward slashes."
        },
        "line": {
          "type": "integer",
          "description": "1-based line of the loop that justifies the claim."
        }
      }
    },
    "smell": {
      "type": "object",
      "required": ["rule", "message", "file", "line"],
      "properties": {
        "package": {
          "type": "string",
          "description": "Go package path owning the smelling function. Added in schema 1.4.0; absent in 1.3.0 and earlier documents. Present so consumers can filter first-party findings, which file paths alone cannot express."
        },
        "rule": {
          "type": "string",
          "description": "Canonical rule ID.",
          "pattern": "^SM[0-9]+$"
        },
        "message": {
          "type": "string",
          "description": "Human-readable finding, without the diagnostic's \"smell(SMn):\" prefix."
        },
        "file": {
          "type": "string",
          "description": "Module-relative path, forward slashes."
        },
        "line": {
          "type": "integer",
          "description": "1-based line."
        }
      }
    },
    "function": {
      "type": "object",
      "required": ["package", "func", "file", "line", "time"],
      "properties": {
        "package": { "type": "string", "description": "Import path." },
        "func": { "type": "string", "description": "Function or method name." },
        "receiver": { "type": "string", "description": "Method receiver type as written, e.g. \"*Tree\"; absent for plain functions." },
        "file": { "type": "string", "description": "Module-relative path, forward slashes." },
        "line": { "type": "integer" },
        "time": { "$ref": "#/$defs/bound", "description": "Inferred asymptotic time bound." },
        "causes": {
          "type": "array",
          "description": "Why the time bound is top; present exactly when time.top is true.",
          "items": { "$ref": "#/$defs/cause" }
        },
        "budget": { "$ref": "#/$defs/budget", "description": "The //bigo:max declaration and its verdict, when declared." },
        "space": { "$ref": "#/$defs/space", "description": "The //bigo:space picture, when declared." },
        "trust": {
          "type": "array",
          "description": "Raw //bigo:cost / //bigo:ignore directives declared on this function.",
          "items": { "type": "string" }
        },
        "provenance": {
          "type": "string",
          "enum": ["assumed", "assumption-tainted"],
          "description": "Present only when an external assumption influenced this entry: assumed on an assumption's own target, assumption-tainted when an assumed summary is in the bound's support. Absent means inferred. Added in schema 1.2.0."
        }
      }
    },
    "bound": {
      "type": "object",
      "description": "An asymptotic bound: either top (unverifiable) or a canonical string plus the antichain of poly-log monomials.",
      "oneOf": [
        { "required": ["top"] },
        { "required": ["str", "terms"] }
      ],
      "properties": {
        "top": { "type": "boolean", "description": "True for the unverifiable bound; str and terms are absent." },
        "str": { "type": "string", "description": "Canonical rendering, e.g. \"O(n log n)\"." },
        "terms": {
          "type": "array",
          "description": "Antichain of monomials, sorted by canonical string. A monomial maps each size variable to its exponents; the empty object is O(1).",
          "items": {
            "type": "object",
            "additionalProperties": { "$ref": "#/$defs/factor" }
          }
        }
      }
    },
    "factor": {
      "type": "object",
      "description": "One variable's exponents within a monomial: v^pow · (log v)^log. Omitted members are zero.",
      "properties": {
        "pow": { "type": "integer" },
        "log": { "type": "integer" }
      }
    },
    "cause": {
      "type": "object",
      "required": ["kind", "detail"],
      "properties": {
        "kind": {
          "type": "string",
          "description": "Machine-readable cause category. Known kinds: call, defer, go, loop, irreducible, nobody. Open set — new engine work may add kinds; consumers must tolerate unknown values."
        },
        "detail": { "type": "string", "description": "Human-readable description. Presentation text — never dispatch on it." },
        "file": { "type": "string", "description": "Module-relative position of the blocker, when known." },
        "line": { "type": "integer" },
        "callee": {
          "type": "string",
          "description": "Cost-table key of the blocking callee: package-qualified, receiver-qualified for methods, generic instantiations resolved to their origin. This is the vocabulary a trust file is written in, and it is NOT a parse of detail — the two render a callee differently. Present only for call and defer causes with a static callee; ABSENT for loops, goroutines, interface dispatch and function values, and that absence is the signal that no trust-file entry can address this blocker. Added in schema 1.3.0."
        }
      }
    },
    "budget": {
      "type": "object",
      "required": ["raw", "verdict"],
      "properties": {
        "raw": { "type": "string", "description": "The directive as written, including any where-bindings." },
        "bound": { "$ref": "#/$defs/bound", "description": "The normalized budget; absent when verdict is invalid." },
        "verdict": {
          "type": "string",
          "enum": ["within", "exceeds", "unverifiable", "invalid"],
          "description": "Sound three-valued verdict, plus invalid for budgets that failed to normalize. Closed vocabulary — a new verdict would be a major schema change."
        }
      }
    },
    "space": {
      "type": "object",
      "required": ["heap", "stack"],
      "properties": {
        "heap": { "$ref": "#/$defs/bound", "description": "Total-allocation upper bound; proves within only, never exceeds." },
        "stack": { "$ref": "#/$defs/bound", "description": "Peak recursion depth; proves both within and exceeds." },
        "budget": { "$ref": "#/$defs/budget" }
      }
    },
    "trustEntry": {
      "type": "object",
      "required": ["package", "func", "directive"],
      "properties": {
        "package": { "type": "string" },
        "func": { "type": "string" },
        "receiver": { "type": "string" },
        "directive": { "type": "string", "description": "The assertion as written." }
      }
    },
    "assumption": {
      "type": "object",
      "required": ["key", "bound"],
      "properties": {
        "key": { "type": "string", "description": "Package-qualified function name; receiver-qualified for methods, e.g. \"(*sync.Once).Do\"." },
        "bound": { "type": "string", "description": "The assumed bound expression as written in the assumption file." }
      }
    }
  }
}
